{
  "id": "CHAOS-011",
  "name": "Sessão do Navegador Deslogada",
  "batch": 3,
  "injection_point": "FireflyStateReader",
  "initial_state": "FIREFLY_CANVAS_POLLING",
  "injected_fault": "session_logged_out",
  "expected_terminal_state": "FAILED",
  "mandatory_events": ["JOB_SUBMITTED", "AGENT_FAILED"],
  "forbidden_events": ["AGENT_COMPLETED"],
  "retry_limit": 1,
  "recovery_expectation": {
    "recoverable": false,
    "same_run_id_required": false
  },
  "cleanup_strategy": "KILL_ORPHAN_PROCESSES"
}
